[
 {
  "concept_id": "jee-physics-rotational-motion-concept-001",
  "display_name": "Centre of mass of a two-particle system",
  "subject": "Physics",
  "chapter": "Rotational Motion",
  "parent_concept_id": null,
  "child_concept_ids": [
   "jee-physics-rotational-motion-concept-002"
  ],
  "aliases": [
   "two-particle centre of mass",
   "two-particle center of mass",
   "COM of two particles"
  ],
  "prerequisite_concept_ids": [],
  "related_concept_ids": [
   "jee-physics-rotational-motion-concept-002",
   "jee-physics-rotational-motion-concept-015"
  ],
  "syllabus_subtopic_ref": "Centre of mass of a two-particle system"
 },
 {
  "concept_id": "jee-physics-rotational-motion-concept-002",
  "display_name": "Centre of mass of a rigid body",
  "subject": "Physics",
  "chapter": "Rotational Motion",
  "parent_concept_id": "jee-physics-rotational-motion-concept-001",
  "child_concept_ids": [],
  "aliases": [
   "rigid-body centre of mass",
   "rigid-body center of mass",
   "COM of a rigid body"
  ],
  "prerequisite_concept_ids": [
   "jee-physics-rotational-motion-concept-001"
  ],
  "related_concept_ids": [
   "jee-physics-rotational-motion-concept-001"
  ],
  "syllabus_subtopic_ref": "Centre of mass of a rigid body"
 },
 {
  "concept_id": "jee-physics-rotational-motion-concept-003",
  "display_name": "Basic concepts of rotational motion",
  "subject": "Physics",
  "chapter": "Rotational Motion",
  "parent_concept_id": null,
  "child_concept_ids": [
   "jee-physics-rotational-motion-concept-004",
   "jee-physics-rotational-motion-concept-006",
   "jee-physics-rotational-motion-concept-008",
   "jee-physics-rotational-motion-concept-013",
   "jee-physics-rotational-motion-concept-014",
   "jee-physics-rotational-motion-concept-015"
  ],
  "aliases": [
   "rotational motion basics",
   "angular motion basics",
   "fundamentals of rotational motion",
   "rotational motion",
   "rotational dynamics"
  ],
  "prerequisite_concept_ids": [],
  "related_concept_ids": [
   "jee-physics-rotational-motion-concept-014",
   "jee-physics-rotational-motion-concept-015"
  ],
  "syllabus_subtopic_ref": "Basic concepts of rotational motion"
 },
 {
  "concept_id": "jee-physics-rotational-motion-concept-004",
  "display_name": "Moment of a force",
  "subject": "Physics",
  "chapter": "Rotational Motion",
  "parent_concept_id": "jee-physics-rotational-motion-concept-003",
  "child_concept_ids": [
   "jee-physics-rotational-motion-concept-005"
  ],
  "aliases": [
   "moment of force",
   "turning effect of a force",
   "force moment"
  ],
  "prerequisite_concept_ids": [
   "jee-physics-rotational-motion-concept-003"
  ],
  "related_concept_ids": [
   "jee-physics-rotational-motion-concept-005",
   "jee-physics-rotational-motion-concept-013"
  ],
  "syllabus_subtopic_ref": "Moment of a force",
  "note": "Open question for review: Moment of a force and torque are physically the same quantity. This node remains separate from concept 005 pending sanrishi's resolution."
 },
 {
  "concept_id": "jee-physics-rotational-motion-concept-005",
  "display_name": "Torque",
  "subject": "Physics",
  "chapter": "Rotational Motion",
  "parent_concept_id": "jee-physics-rotational-motion-concept-004",
  "child_concept_ids": [],
  "aliases": [
   "turning moment",
   "torque of a force",
   "τ",
   "torque"
  ],
  "prerequisite_concept_ids": [
   "jee-physics-rotational-motion-concept-004"
  ],
  "related_concept_ids": [
   "jee-physics-rotational-motion-concept-004",
   "jee-physics-rotational-motion-concept-006"
  ],
  "syllabus_subtopic_ref": "Torque",
  "note": "Open question for review: Torque and moment of a force are physically the same quantity. This node remains separate from concept 004 pending sanrishi's resolution."
 },
 {
  "concept_id": "jee-physics-rotational-motion-concept-006",
  "display_name": "Angular momentum",
  "subject": "Physics",
  "chapter": "Rotational Motion",
  "parent_concept_id": "jee-physics-rotational-motion-concept-003",
  "child_concept_ids": [
   "jee-physics-rotational-motion-concept-007"
  ],
  "aliases": [
   "rotational momentum",
   "L",
   "angular momentum"
  ],
  "prerequisite_concept_ids": [
   "jee-physics-rotational-motion-concept-005"
  ],
  "related_concept_ids": [
   "jee-physics-rotational-motion-concept-007",
   "jee-physics-rotational-motion-concept-008"
  ],
  "syllabus_subtopic_ref": "Angular momentum"
 },
 {
  "concept_id": "jee-physics-rotational-motion-concept-007",
  "display_name": "Conservation of angular momentum and its applications",
  "subject": "Physics",
  "chapter": "Rotational Motion",
  "parent_concept_id": "jee-physics-rotational-motion-concept-006",
  "child_concept_ids": [],
  "aliases": [
   "angular momentum conservation",
   "conservation of L",
   "angular momentum applications"
  ],
  "prerequisite_concept_ids": [
   "jee-physics-rotational-motion-concept-006"
  ],
  "related_concept_ids": [
   "jee-physics-rotational-motion-concept-006"
  ],
  "syllabus_subtopic_ref": "Conservation of angular momentum and its applications"
 },
 {
  "concept_id": "jee-physics-rotational-motion-concept-008",
  "display_name": "Moment of inertia",
  "subject": "Physics",
  "chapter": "Rotational Motion",
  "parent_concept_id": "jee-physics-rotational-motion-concept-003",
  "child_concept_ids": [
   "jee-physics-rotational-motion-concept-009",
   "jee-physics-rotational-motion-concept-010",
   "jee-physics-rotational-motion-concept-011",
   "jee-physics-rotational-motion-concept-012"
  ],
  "aliases": [
   "rotational inertia",
   "I",
   "moment of inertia"
  ],
  "prerequisite_concept_ids": [
   "jee-physics-rotational-motion-concept-003"
  ],
  "related_concept_ids": [
   "jee-physics-rotational-motion-concept-009",
   "jee-physics-rotational-motion-concept-010",
   "jee-physics-rotational-motion-concept-011",
   "jee-physics-rotational-motion-concept-012"
  ],
  "syllabus_subtopic_ref": "Moment of inertia"
 },
 {
  "concept_id": "jee-physics-rotational-motion-concept-009",
  "display_name": "Radius of gyration",
  "subject": "Physics",
  "chapter": "Rotational Motion",
  "parent_concept_id": "jee-physics-rotational-motion-concept-008",
  "child_concept_ids": [],
  "aliases": [
   "gyration radius",
   "radius of gyration k",
   "k radius"
  ],
  "prerequisite_concept_ids": [
   "jee-physics-rotational-motion-concept-008"
  ],
  "related_concept_ids": [
   "jee-physics-rotational-motion-concept-008"
  ],
  "syllabus_subtopic_ref": "Radius of gyration"
 },
 {
  "concept_id": "jee-physics-rotational-motion-concept-010",
  "display_name": "Values of moment of inertia for simple geometrical objects",
  "subject": "Physics",
  "chapter": "Rotational Motion",
  "parent_concept_id": "jee-physics-rotational-motion-concept-008",
  "child_concept_ids": [],
  "aliases": [
   "standard moments of inertia",
   "MOI of standard bodies",
   "geometrical body inertia values"
  ],
  "prerequisite_concept_ids": [
   "jee-physics-rotational-motion-concept-008"
  ],
  "related_concept_ids": [
   "jee-physics-rotational-motion-concept-008"
  ],
  "syllabus_subtopic_ref": "Values of moment of inertia for simple geometrical objects"
 },
 {
  "concept_id": "jee-physics-rotational-motion-concept-011",
  "display_name": "Parallel axes theorem",
  "subject": "Physics",
  "chapter": "Rotational Motion",
  "parent_concept_id": "jee-physics-rotational-motion-concept-008",
  "child_concept_ids": [],
  "aliases": [
   "parallel axis theorem",
   "Steiner theorem",
   "parallel axes rule"
  ],
  "prerequisite_concept_ids": [
   "jee-physics-rotational-motion-concept-008"
  ],
  "related_concept_ids": [
   "jee-physics-rotational-motion-concept-012"
  ],
  "syllabus_subtopic_ref": "Parallel axes theorem"
 },
 {
  "concept_id": "jee-physics-rotational-motion-concept-012",
  "display_name": "Perpendicular axes theorem",
  "subject": "Physics",
  "chapter": "Rotational Motion",
  "parent_concept_id": "jee-physics-rotational-motion-concept-008",
  "child_concept_ids": [],
  "aliases": [
   "perpendicular axis theorem",
   "perpendicular axes rule",
   "lamina axes theorem"
  ],
  "prerequisite_concept_ids": [
   "jee-physics-rotational-motion-concept-008"
  ],
  "related_concept_ids": [
   "jee-physics-rotational-motion-concept-011"
  ],
  "syllabus_subtopic_ref": "Perpendicular axes theorem"
 },
 {
  "concept_id": "jee-physics-rotational-motion-concept-013",
  "display_name": "Equilibrium of rigid bodies",
  "subject": "Physics",
  "chapter": "Rotational Motion",
  "parent_concept_id": "jee-physics-rotational-motion-concept-003",
  "child_concept_ids": [],
  "aliases": [
   "rigid body equilibrium",
   "rotational equilibrium",
   "static equilibrium of rigid bodies"
  ],
  "prerequisite_concept_ids": [
   "jee-physics-rotational-motion-concept-005"
  ],
  "related_concept_ids": [
   "jee-physics-rotational-motion-concept-004",
   "jee-physics-rotational-motion-concept-005"
  ],
  "syllabus_subtopic_ref": "Equilibrium of rigid bodies"
 },
 {
  "concept_id": "jee-physics-rotational-motion-concept-014",
  "display_name": "Rigid body rotation and equations of rotational motion",
  "subject": "Physics",
  "chapter": "Rotational Motion",
  "parent_concept_id": "jee-physics-rotational-motion-concept-003",
  "child_concept_ids": [],
  "aliases": [
   "rotational kinematics",
   "angular kinematics",
   "rotational motion equations",
   "rigid body",
   "rigid body rotation",
   "angular speed",
   "pure rotation"
  ],
  "prerequisite_concept_ids": [
   "jee-physics-rotational-motion-concept-003"
  ],
  "related_concept_ids": [
   "jee-physics-rotational-motion-concept-015"
  ],
  "syllabus_subtopic_ref": "Rigid body rotation and equations of rotational motion"
 },
 {
  "concept_id": "jee-physics-rotational-motion-concept-015",
  "display_name": "Comparison of linear and rotational motions",
  "subject": "Physics",
  "chapter": "Rotational Motion",
  "parent_concept_id": "jee-physics-rotational-motion-concept-003",